Sheet: Counts
A1: Total DFTs | B1: Incomplete DFTs | C1: Complete DFTs | D1: Verified DFTs
A2: of:=COUNTA([$paper_dfts.A2:$paper_dfts.A500]) -> 203 | B2: of:=COUNTIF([$paper_dfts.D2:$paper_dfts.D500];"?") -> 53 | C2: of:=[.A2]-[.B2] -> 150 | D2: of:=COUNTIF([$paper_dfts.E2:$paper_dfts.E500];"YES") -> 5
A3: of:=[.A2]/[.$A2] -> 1 | B3: of:=[.B2]/[.$A2] -> 0.261083743842365 | C3: of:=[.C2]/[.$A2] -> 0.738916256157635 | D3: of:=[.D2]/[.$A2] -> 0.0246305418719212

Sheet: paper_dfts
A1: Paper Name | B1: DF Source Loc | C1: Disp Citation | D1: Psi4 Name | E1: Confirmed with Snakemake? | F1: Comments?
A2: B3LYP-D2 | B2: https://github.com/psi4/psi4/blob/bf9d20fc579995b0bc2c38b749a31c0d6f85c82e/psi4/driver/procrouting/dft/libxc_functionals.py#L71 | C2: TODO | D2: B3LYP-D2
A3: B3LYP-D3(BJ) | C3: TODO | D3: B3LYP-D3(BJ)
A4: B3LYP-D3(CSO) | C4: TODO | D4: ?
A5: B3LYP-D3M(BJ) | C5: TODO | D5: B3LYP-D3M(BJ)
A6: B3LYP-D3(0) | C6: TODO | D6: B3LYP-D3
A7: B3LYP | C7: TODO | D7: B3LYP | E7: YES
A8: B3LYP-NL | C8: TODO | D8: B3LYP-NL
A9: B3P86 | B9: https://github.com/psi4/psi4/blob/bf9d20fc579995b0bc2c38b749a31c0d6f85c82e/psi4/driver/procrouting/dft/libxc_functionals.py#L72 | C9: TODO | D9: B3P86 | E9: YES
A10: B3PW91-D2 | B10: https://github.com/psi4/psi4/blob/bf9d20fc579995b0bc2c38b749a31c0d6f85c82e/psi4/driver/procrouting/dft/libxc_functionals.py#L70 | C10: TODO | D10: ?
A11: B3PW91-D3(BJ) | C11: TODO | D11: B3PW91-D3(BJ)
A12: B3PW91-D3(0) | C12: TODO | D12: B3PW91-D3ZERO
A13: B3PW91 | C13: TODO | D13: B3PW91
A14: B97-1-D2 | B14: https://github.com/psi4/psi4/blob/bf9d20fc579995b0bc2c38b749a31c0d6f85c82e/psi4/driver/procrouting/dft/libxc_functionals.py#L77 | C14: TODO | D14: ?
A15: B97-1 | C15: TODO | D15: B97-1
A16: B97-2-D2 | B16: https://github.com/psi4/psi4/blob/bf9d20fc579995b0bc2c38b749a31c0d6f85c82e/psi4/driver/procrouting/dft/libxc_functionals.py#L78 | C16: TODO | D16: ?
A17: B97-2 | C17: TODO | D17: B97-2
A18: B97-3-D2 | B18: https://github.com/psi4/psi4/blob/bf9d20fc579995b0bc2c38b749a31c0d6f85c82e/psi4/driver/procrouting/dft/libxc_functionals.py#L82C1-L82C6 | C18: TODO | D18: ?
A19: B97-3 | C19: TODO | D19: B97-3
A20: B97-D2 | B20: ? | C20: TODO | D20: B97-D2
A21: B97-D3(BJ) | B21: ? | C21: TODO | D21: B97-D3BJ
A22: B97-D3M(BJ) | B22: ? | C22: TODO | D22: B97-D3MBJ
A23: B97-D3(0) | B23: ? | C23: TODO | D23: B97-D3ZERO
A24: B97-D | B24: https://github.com/psi4/psi4/blob/bf9d20fc579995b0bc2c38b749a31c0d6f85c82e/psi4/driver/procrouting/dft/libxc_functionals.py#L58 | C24: TODO | D24: B97-D
A25: B97 | C25: TODO | D25: ?
A26: B97-K | B26: https://github.com/psi4/psi4/blob/bf9d20fc579995b0bc2c38b749a31c0d6f85c82e/psi4/driver/procrouting/dft/libxc_functionals.py#L81 | C26: TODO | D26: B97-K
A27: B97M-rV | C27: TODO | D27: ?
A28: B97M-V | B28: https://github.com/psi4/psi4/blob/bf9d20fc579995b0bc2c38b749a31c0d6f85c82e/psi4/driver/procrouting/dft/libxc_functionals.py#L141C1-L141C96 | C28: TODO | D28: B97M-V
A29: BLOC-D3(0) | C29: TODO | D29: ?
A30: BLOC | C30: TODO | D30: ?
A31: BLYP-D2 | B31: https://github.com/psi4/psi4/blob/bf9d20fc579995b0bc2c38b749a31c0d6f85c82e/psi4/driver/procrouting/dft/gga_functionals.py#L34 | C31: TODO | D31: BLYP-D
A32: BLYP-D3(BJ) | C32: TODO | D32: BLYP-D3BJ
A33: BLYP-D3(CSO) | C33: TODO | D33: ?
A34: BLYP-D3M(BJ) | C34: TODO | D34: BLYP-D3M(BJ)
A35: BLYP-D3(0) | C35: TODO | D35: BLYP-D3
A36: BLYP | C36: TODO | D36: BLYP
A37: BLYP-NL | C37: TODO | D37: BLYP-NL
A38: BMK-D2 | B38: https://github.com/psi4/psi4/blob/bf9d20fc579995b0bc2c38b749a31c0d6f85c82e/psi4/driver/procrouting/dft/hyb_functionals.py#L630 | C38: TODO | D38: ?
A39: BMK-D3(BJ) | C39: TODO | D39: BMK-D3(BJ)
A40: BMK-D3(0) | C40: TODO | D40: BMK-D3ZERO
A41: BMK | C41: TODO | D41: BMK
A42: BOP-D3(BJ) | B42: https://github.com/psi4/psi4/blob/bf9d20fc579995b0bc2c38b749a31c0d6f85c82e/psi4/driver/procrouting/dft/gga_functionals.py#L49 | C42: TODO | D42: BOP-D3(BJ)
A43: BOP-D3(0) | C43: TODO | D43: BOP-D3ZERO
A44: BOP | C44: TODO | D44: BOP
A45: BP86-D2 | B45: https://github.com/psi4/psi4/blob/bf9d20fc579995b0bc2c38b749a31c0d6f85c82e/psi4/driver/procrouting/dft/gga_functionals.py#L157 | C45: TODO | D45: BP86-D
A46: BP86-D3(BJ) | C46: TODO | D46: BP86-D3BJ
A47: BP86-D3(CSO) | C47: TODO | D47: ?
A48: BP86-D3M(BJ) | C48: TODO | D48: BP86-D3M(BJ)
A49: BP86-D3(0) | C49: TODO | D49: BP86-D3
A50: BP86 | C50: TODO | D50: BP86
A51: BPBE-D3(BJ) | C51: TODO | D51: ?
A52: BPBE-D3(0) | C52: TODO | D52: ?
A53: BPBE | C53: TODO | D53: ? | F53: b86bpbe?
A54: CAM-B3LYP-D3(BJ) | B54: https://github.com/psi4/psi4/blob/bf9d20fc579995b0bc2c38b749a31c0d6f85c82e/psi4/driver/procrouting/dft/libxc_functionals.py#L100 | C54: TODO | D54: CAM-B3LYP-D3(BJ)
A55: CAM-B3LYP-D3(0) | C55: TODO | D55: CAM-B3LYP-D3ZERO
A56: CAM-B3LYP | C56: TODO | D56: CAM-B3LYP
A57: GAM | B57: https://github.com/psi4/psi4/blob/bf9d20fc579995b0bc2c38b749a31c0d6f85c82e/psi4/driver/procrouting/dft/gga_functionals.py#L301C1-L301C6 | C57: TODO | D57: GAM
A58: HCTH/120-D3(BJ) | B58: https://github.com/psi4/psi4/blob/bf9d20fc579995b0bc2c38b749a31c0d6f85c82e/psi4/driver/procrouting/dft/libxc_functionals.py#L53C1-L53C6 | C58: TODO | D58: HCTH120-D3(BJ)
A59: HCTH/120-D3(0) | C59: TODO | D59: HCTH120-D3ZERO
A60: HCTH/120 | C60: TODO | D60: HCTH120
A61: HCTH/147 | B61: https://github.com/psi4/psi4/blob/bf9d20fc579995b0bc2c38b749a31c0d6f85c82e/psi4/driver/procrouting/dft/libxc_functionals.py#L54 | C61: TODO | D61: HCTH147
A62: HCTH/407 | B62: https://github.com/psi4/psi4/blob/bf9d20fc579995b0bc2c38b749a31c0d6f85c82e/psi4/driver/procrouting/dft/libxc_functionals.py#L55 | C62: TODO | D62: HCTH407
A63: HCTH/93 | B63: https://github.com/psi4/psi4/blob/bf9d20fc579995b0bc2c38b749a31c0d6f85c82e/psi4/driver/procrouting/dft/libxc_functionals.py#L52 | C63: TODO | D63: HCTH93
A64: HF-D3(BJ) | B64: https://github.com/psi4/psi4/blob/bf9d20fc579995b0bc2c38b749a31c0d6f85c82e/psi4/driver/procrouting/dft/hyb_functionals.py#L85 | C64: TODO | D64: HF-D3(BJ)
A65: HF-D3(0) | C65: TODO | D65: HF-D3ZERO
A66: HF | C66: TODO | D66: HF
A67: HF-NL | C67: TODO | D67: HF-NL
A68: HFLYP | B68: x | C68: TODO | D68: ?
A69: HFPW92 | B69: x | C69: TODO | D69: ?
A70: HSE-HJS-D3(BJ) | B70: x | C70: TODO | D70: ?
A71: HSE-HJS-D3(0) | B71: x | C71: TODO | D71: ?
A72: HSE-HJS | B72: x | C72: TODO | D72: ?
A73: LC-VV10 | B73: https://github.com/psi4/psi4/blob/bf9d20fc579995b0bc2c38b749a31c0d6f85c82e/psi4/driver/procrouting/dft/libxc_functionals.py#L118 | C73: TODO | D73: LC-VV10
A74: LC-wPBE08-D3(BJ) | B74: x | C74: TODO | D74: ?
A75: LC-wPBE08-D3M(BJ) | B75: x | C75: TODO | D75: ?
A76: LC-wPBE08-D3(0) | B76: x | C76: TODO | D76: ?
A77: LC-wPBE08 | B77: x | C77: TODO | D77: ? | F77: b88b95-d3atm None ALIAS: wb97x-d3LC-wPBE0
A78: LRC-wPBE | B78: https://github.com/psi4/psi4/blob/bf9d20fc579995b0bc2c38b749a31c0d6f85c82e/psi4/driver/procrouting/dft/libxc_functionals.py#L121 | C78: TODO | D78: LRC-wPBE
A79: LRC-wPBEh | B79: https://github.com/psi4/psi4/blob/bf9d20fc579995b0bc2c38b749a31c0d6f85c82e/psi4/driver/procrouting/dft/libxc_functionals.py#L114 | C79: TODO | D79: LRC-wPBEh
A80: M05-2X-D3(0) | B80: https://github.com/psi4/psi4/blob/bf9d20fc579995b0bc2c38b749a31c0d6f85c82e/psi4/driver/procrouting/dft/hyb_functionals.py#L445 | C80: TODO | D80: M05-2X-D3ZERO
A81: M05-2X | C81: TODO | D81: M05-2X
A82: M05-D3(0) | B82: https://github.com/psi4/psi4/blob/bf9d20fc579995b0bc2c38b749a31c0d6f85c82e/psi4/driver/procrouting/dft/hyb_functionals.py#L430 | C82: TODO | D82: M05-D3ZERO
A83: M05 | C83: TODO | D83: M05
A84: M06-2X-D2 | B84: https://github.com/psi4/psi4/blob/bf9d20fc579995b0bc2c38b749a31c0d6f85c82e/psi4/driver/procrouting/dft/hyb_functionals.py#L475 | C84: TODO | D84: ?
A85: M06-2X-D3(0) | C85: TODO | D85: M06-2X-D3ZERO
A86: M06-2X | C86: TODO | D86: M06-2X
A87: M06-D2 | B87: https://github.com/psi4/psi4/blob/bf9d20fc579995b0bc2c38b749a31c0d6f85c82e/psi4/driver/procrouting/dft/hyb_functionals.py#L460 | C87: TODO | D87: ?
A88: M06-D3(0) | C88: TODO | D88: M06-D3ZERO
A89: M06 | C89: TODO | D89: M06
A90: M06-HF-D3(0) | B90: https://github.com/psi4/psi4/blob/bf9d20fc579995b0bc2c38b749a31c0d6f85c82e/psi4/driver/procrouting/dft/hyb_functionals.py#L491 | C90: TODO | D90: M06-HF-D3ZERO
A91: M06-HF | C91: TODO | D91: M06-HF
A92: M06-L-D2 | B92: https://github.com/psi4/psi4/blob/bf9d20fc579995b0bc2c38b749a31c0d6f85c82e/psi4/driver/procrouting/dft/mgga_functionals.py#L34 | C92: TODO | D92: ?
A93: M06-L-D3(0) | C93: TODO | D93: M06-L-D3ZERO
A94: M06-L | C94: TODO | D94: M06-L
A95: M08-HX | B95: https://github.com/psi4/psi4/blob/bf9d20fc579995b0bc2c38b749a31c0d6f85c82e/psi4/driver/procrouting/dft/hyb_functionals.py#L507 | C95: TODO | D95: M08-HX
A96: M08-SO | B96: https://github.com/psi4/psi4/blob/bf9d20fc579995b0bc2c38b749a31c0d6f85c82e/psi4/driver/procrouting/dft/hyb_functionals.py#L523 | C96: TODO | D96: M08-SO
A97: M11-D3(BJ) | B97: https://github.com/psi4/psi4/blob/bf9d20fc579995b0bc2c38b749a31c0d6f85c82e/psi4/driver/procrouting/dft/hyb_functionals.py#L539 | C97: TODO | D97: M11-D3(BJ)
A98: M11 | C98: TODO | D98: M11
A99: M11-L-D3(0) | B99: https://github.com/psi4/psi4/blob/bf9d20fc579995b0bc2c38b749a31c0d6f85c82e/psi4/driver/procrouting/dft/mgga_functionals.py#L61 | C99: TODO | D99: M11-L-D3ZERO
A100: M11-L | C100: TODO | D100: M11-L
A101: mBEEF | B101: x | C101: TODO | D101: ?
A102: MS0-D3(0) | B102: https://github.com/psi4/psi4/blob/bf9d20fc579995b0bc2c38b749a31c0d6f85c82e/psi4/driver/procrouting/dft/mgga_functionals.py#L100 | C102: TODO | D102: ? | F102: Weirdly, MGGA_MVSh is aliased to MVSh, but none of the other MGGA_*s have such an alias
A103: MS0 | C103: TODO | D103: MGGA_MS0 | E103: YES | F103: Weirdly, MGGA_MVSh is aliased to MVSh, but none of the other MGGA_*s have such an alias
A104: MS1-D3(0) | B104: https://github.com/psi4/psi4/blob/bf9d20fc579995b0bc2c38b749a31c0d6f85c82e/psi4/driver/procrouting/dft/mgga_functionals.py#L113 | C104: TODO | D104: ? | F104: Weirdly, MGGA_MVSh is aliased to MVSh, but none of the other MGGA_*s have such an alias
A105: MS1 | C105: TODO | D105: MGGA_MS1 | F105: Weirdly, MGGA_MVSh is aliased to MVSh, but none of the other MGGA_*s have such an alias
A106: MS2-D3(0) | B106: https://github.com/psi4/psi4/blob/bf9d20fc579995b0bc2c38b749a31c0d6f85c82e/psi4/driver/procrouting/dft/mgga_functionals.py#L126 | C106: TODO | D106: ? | F106: Weirdly, MGGA_MVSh is aliased to MVSh, but none of the other MGGA_*s have such an alias
A107: MS2 | C107: TODO | D107: MGGA_MS2 | F107: Weirdly, MGGA_MVSh is aliased to MVSh, but none of the other MGGA_*s have such an alias
A108: MS2h-D3(0) | B108: https://github.com/psi4/psi4/blob/bf9d20fc579995b0bc2c38b749a31c0d6f85c82e/psi4/driver/procrouting/dft/hyb_functionals.py#L311 | C108: TODO | D108: ? | F108: Weirdly, MGGA_MVSh is aliased to MVSh, but none of the other MGGA_*s have such an alias
A109: MS2h | C109: TODO | D109: MGGA_MS2h | F109: Weirdly, MGGA_MVSh is aliased to MVSh, but none of the other MGGA_*s have such an alias
A110: MVS | B110: https://github.com/psi4/psi4/blob/bf9d20fc579995b0bc2c38b749a31c0d6f85c82e/psi4/driver/procrouting/dft/mgga_functionals.py#L139 | C110: TODO | D110: MGGA_MVS | F110: Weirdly, MGGA_MVSh is aliased to MVSh, but none of the other MGGA_*s have such an alias
A111: MVSh | B111: https://github.com/psi4/psi4/blob/bf9d20fc579995b0bc2c38b749a31c0d6f85c82e/psi4/driver/procrouting/dft/hyb_functionals.py#L326 | C111: TODO | D111: MVSh | E111: YES | F111: Weirdly, MGGA_MVSh is aliased to MVSh, but none of the other MGGA_*s have such an alias
A112: MN12-L-D3(BJ) | B112: https://github.com/psi4/psi4/blob/bf9d20fc579995b0bc2c38b749a31c0d6f85c82e/psi4/driver/procrouting/dft/mgga_functionals.py#L74 | C112: TODO | D112: MN12-L-D3(BJ)
A113: MN12-L | C113: TODO | D113: MN12-L
A114: MN12-SX-D3(BJ) | B114: https://github.com/psi4/psi4/blob/bf9d20fc579995b0bc2c38b749a31c0d6f85c82e/psi4/driver/procrouting/dft/hyb_functionals.py#L203 | C114: TODO | D114: MN12-SX-D3(BJ)
A115: MN12-SX | C115: TODO | D115: MN12-SX
A116: MN15 | B116: https://github.com/psi4/psi4/blob/bf9d20fc579995b0bc2c38b749a31c0d6f85c82e/psi4/driver/procrouting/dft/hyb_functionals.py#L218 | C116: TODO | D116: MN15
A117: MN15-L | B117: https://github.com/psi4/psi4/blob/bf9d20fc579995b0bc2c38b749a31c0d6f85c82e/psi4/driver/procrouting/dft/mgga_functionals.py#L87 | C117: TODO | D117: MN15-L
A118: mPW91 | B118: x | C118: TODO | D118: ?
A119: N12-D3(0) | B119: https://github.com/psi4/psi4/blob/bf9d20fc579995b0bc2c38b749a31c0d6f85c82e/psi4/driver/procrouting/dft/gga_functionals.py#L121 | C119: TODO | D119: N12-D3ZERO
A120: N12 | C120: TODO | D120: N12
A121: N12-SX-D3(BJ) | B121: https://github.com/psi4/psi4/blob/bf9d20fc579995b0bc2c38b749a31c0d6f85c82e/psi4/driver/procrouting/dft/hyb_functionals.py#L232 | C121: TODO | D121: N12-SX-D3(BJ)
A122: N12-SX | C122: TODO | D122: N12-SX
A123: OLYP-D3(BJ) | B123: x | C123: TODO | D123: ?
A124: OLYP-D3(0) | B124: x | C124: TODO | D124: ?
A125: OLYP | B125: x | C125: TODO | D125: ?
A126: oTPSS-D3(BJ) | B126: x | C126: TODO | D126: ? | F126: Maybe otpss-d
A127: oTPSS-D3(0) | B127: x | C127: TODO | D127: ? | F127: Maybe otpss-d
A128: PBE0-D2 | B128: https://github.com/psi4/psi4/blob/bf9d20fc579995b0bc2c38b749a31c0d6f85c82e/psi4/driver/procrouting/dft/libxc_functionals.py#L75 | C128: TODO | D128: PBE0-D2
A129: PBE0-D3(BJ) | C129: TODO | D129: PBE0-D3(BJ)
A130: PBE0-D3(CSO) | C130: TODO | D130: ?
A131: PBE0-D3M(BJ) | C131: TODO | D131: PBE0-D3M(BJ)
A132: PBE0-D3(0) | C132: TODO | D132: PBE0-D3ZERO
A133: PBE0 | C133: TODO | D133: PBE0 | E133: YES
A134: PBE-D2 | B134: https://github.com/psi4/psi4/blob/bf9d20fc579995b0bc2c38b749a31c0d6f85c82e/psi4/driver/procrouting/dft/gga_functionals.py#L85 | C134: TODO | D134: PBE-D2
A135: PBE-D3(BJ) | C135: TODO | D135: PBE-D3(BJ)
A136: PBE-D3(CSO) | C136: TODO | D136: ?
A137: PBE-D3M(BJ) | C137: TODO | D137: PBE-D3M(BJ)
A138: PBE-D3(0) | C138: TODO | D138: PBE-D3ZERO
A139: PBE | C139: TODO | D139: PBE
A140: PBEh-3c | B140: https://github.com/psi4/psi4/blob/bf9d20fc579995b0bc2c38b749a31c0d6f85c82e/psi4/driver/procrouting/dft/hyb_functionals.py#L129 | C140: TODO | D140: pbeh3c
A141: PBEOP | B141: https://github.com/psi4/psi4/blob/bf9d20fc579995b0bc2c38b749a31c0d6f85c82e/psi4/driver/procrouting/dft/gga_functionals.py#L313 | C141: TODO | D141: PBEOP
A142: PBEsol-D3(BJ) | B142: https://github.com/psi4/psi4/blob/bf9d20fc579995b0bc2c38b749a31c0d6f85c82e/psi4/driver/procrouting/dft/gga_functionals.py#L329 | C142: TODO | D142: PBEsol-D3(BJ)
A143: PBEsol-D3(0) | C143: TODO | D143: PBEsol-D3ZERO
A144: PBEsol | C144: TODO | D144: PBEsol
A145: PKZB | B145: https://github.com/psi4/psi4/blob/bf9d20fc579995b0bc2c38b749a31c0d6f85c82e/psi4/driver/procrouting/dft/mgga_functionals.py#L176 | C145: TODO | D145: PKZB
A146: PW6B95-D2 | B146: https://github.com/psi4/psi4/blob/bf9d20fc579995b0bc2c38b749a31c0d6f85c82e/psi4/driver/procrouting/dft/hyb_functionals.py#L351 | C146: TODO | D146: PW6B95-D2
A147: PW6B95-D3(BJ) | C147: TODO | D147: PW6B95-D3(BJ)
A148: PW6B95-D3(CSO) | C148: TODO | D148: ?
A149: PW6B95-D3(0) | C149: TODO | D149: PW6B95-D3ZERO
A150: PW6B95 | C150: TODO | D150: PW6B95
A151: PW91 | B151: https://github.com/psi4/psi4/blob/bf9d20fc579995b0bc2c38b749a31c0d6f85c82e/psi4/driver/procrouting/dft/gga_functionals.py#L133 | C151: TODO | D151: PW91
A152: PWB6K-D3(BJ) | B152: https://github.com/psi4/psi4/blob/bf9d20fc579995b0bc2c38b749a31c0d6f85c82e/psi4/driver/procrouting/dft/libxc_functionals.py#L134C5-L134C6 | C152: TODO | D152: PWB6K-D3(BJ)
A153: PWB6K-D3(0) | C153: TODO | D153: PWB6K-D3ZERO
A154: PWB6K | C154: TODO | D154: PWB6K
A155: revPBE0-D3(BJ) | B155: https://github.com/psi4/psi4/blob/bf9d20fc579995b0bc2c38b749a31c0d6f85c82e/psi4/driver/procrouting/dft/hyb_functionals.py#L263 | C155: TODO | D155: revPBE0-D3(BJ)
A156: revPBE0-D3(0) | C156: TODO | D156: revPBE0-D3ZERO
A157: revPBE0 | C157: TODO | D157: revPBE0
A158: revPBE-D2 | B158: https://github.com/psi4/psi4/blob/bf9d20fc579995b0bc2c38b749a31c0d6f85c82e/psi4/driver/procrouting/dft/gga_functionals.py#L109 | C158: TODO | D158: revPBE-D2
A159: revPBE-D3(BJ) | C159: TODO | D159: revPBE-D3(BJ)
A160: revPBE-D3(0) | C160: TODO | D160: revPBE0-D3ZERO
A161: revPBE | C161: TODO | D161: revPBE
A162: revPBE-NL | C162: TODO | D162: revPBE-NL
A163: revTPSS | B163: https://github.com/psi4/psi4/blob/bf9d20fc579995b0bc2c38b749a31c0d6f85c82e/psi4/driver/procrouting/dft/mgga_functionals.py#L164 | C163: TODO | D163: revTPSS
A164: revTPSSh | B164: https://github.com/psi4/psi4/blob/bf9d20fc579995b0bc2c38b749a31c0d6f85c82e/psi4/driver/procrouting/dft/libxc_functionals.py#L136 | C164: TODO | D164: revTPSSh
A165: RPBE-D3(BJ) | B165: https://github.com/psi4/psi4/blob/bf9d20fc579995b0bc2c38b749a31c0d6f85c82e/psi4/driver/procrouting/dft/gga_functionals.py#L97 | C165: TODO | D165: RPBE-D3(BJ)
A166: RPBE-D3(0) | C166: TODO | D166: RPBE-D3ZERO
A167: RPBE | C167: TODO | D167: RPBE
A168: rPW86PBE-D3(BJ) | B168: x | C168: TODO | D168: ?
A169: rPW86PBE-D3(0) | B169: x | C169: TODO | D169: ?
A170: rPW86PBE | B170: x | C170: TODO | D170: ?
A171: rVV10 | B171: x | C171: TODO | D171: ?
A172: SCAN0 | B172: https://github.com/psi4/psi4/blob/bf9d20fc579995b0bc2c38b749a31c0d6f85c82e/psi4/driver/procrouting/dft/hyb_functionals.py#L600 | C172: TODO | D172: SCAN0
A173: SCAN-D3(BJ) | B173: https://github.com/psi4/psi4/blob/bf9d20fc579995b0bc2c38b749a31c0d6f85c82e/psi4/driver/procrouting/dft/mgga_functionals.py#L223 | C173: TODO | D173: SCAN-D3(BJ)
A174: SCAN-D3(0) | C174: TODO | D174: SCAN-D3ZERO
A175: SCAN | C175: TODO | D175: SCAN
A176: SCAN+rVV10 | C176: TODO | D176: ?
A177: SOGGA11-X-D3(BJ) | B177: https://github.com/psi4/psi4/blob/bf9d20fc579995b0bc2c38b749a31c0d6f85c82e/psi4/driver/procrouting/dft/hyb_functionals.py#L188 | C177: TODO | D177: SOGGA11-X-D3(BJ)
A178: SOGGA11-X | C178: TODO | D178: SOGGA11-X
A179: SOGGA | B179: https://github.com/psi4/psi4/blob/bf9d20fc579995b0bc2c38b749a31c0d6f85c82e/psi4/driver/procrouting/dft/gga_functionals.py#L184C7-L184C8 | C179: TODO | D179: SOGGA
A180: SPW92 | B180: https://github.com/psi4/psi4/blob/bf9d20fc579995b0bc2c38b749a31c0d6f85c82e/psi4/driver/procrouting/dft/lda_functionals.py#L44 | C180: TODO | D180: SPW92
A181: SVWN5 | B181: x | C181: TODO | D181: ? | F181: svwn?
A182: t-HCTH | B182: https://github.com/psi4/psi4/blob/bf9d20fc579995b0bc2c38b749a31c0d6f85c82e/psi4/driver/procrouting/dft/mgga_functionals.py#L288C7-L288C8 | C182: TODO | D182: t-HCTH
A183: t-HCTHh | B183: https://github.com/psi4/psi4/blob/bf9d20fc579995b0bc2c38b749a31c0d6f85c82e/psi4/driver/procrouting/dft/hyb_functionals.py#L644 | C183: TODO | D183: t-HCTHh
A184: TM | B184: x | C184: TODO | D184: ?
A185: TPSS-D2 | B185: https://github.com/psi4/psi4/blob/bf9d20fc579995b0bc2c38b749a31c0d6f85c82e/psi4/driver/procrouting/dft/mgga_functionals.py#L152 | C185: TODO | D185: TPSS-D2
A186: TPSS-D3(BJ) | C186: TODO | D186: TPSS-D3(BJ)
A187: TPSS-D3(CSO) | C187: TODO | D187: ?
A188: TPSS-D3(0) | C188: TODO | D188: TPSS-D3ZERO
A189: TPSS | C189: TODO | D189: TPSS
A190: TPSSh-D2 | B190: https://github.com/psi4/psi4/blob/bf9d20fc579995b0bc2c38b749a31c0d6f85c82e/psi4/driver/procrouting/dft/libxc_functionals.py#L135 | C190: TODO | D190: TPSSh-D2
A191: TPSSh-D3(BJ) | C191: TODO | D191: TPSSh-D3(BJ)
A192: TPSSh-D3(0) | C192: TODO | D192: TPSSh-D3ZERO
A193: TPSSh | C193: TODO | D193: TPSSh
A194: VV10 | B194: https://github.com/psi4/psi4/blob/bf9d20fc579995b0bc2c38b749a31c0d6f85c82e/psi4/driver/procrouting/dft/libxc_functionals.py#L68 | C194: TODO | D194: VV10
A195: wB97 | B195: https://github.com/psi4/psi4/blob/bf9d20fc579995b0bc2c38b749a31c0d6f85c82e/psi4/driver/procrouting/dft/libxc_functionals.py#L110 | C195: TODO | D195: wB97
A196: wB97M-rV | B196: x | C196: TODO | D196: ?
A197: wB97M-V | B197: https://github.com/psi4/psi4/blob/bf9d20fc579995b0bc2c38b749a31c0d6f85c82e/psi4/driver/procrouting/dft/libxc_functionals.py#L137 | C197: TODO | D197: wB97M-V
A198: wB97X-D3 | B198: https://github.com/psi4/psi4/blob/bf9d20fc579995b0bc2c38b749a31c0d6f85c82e/psi4/driver/procrouting/dft/libxc_functionals.py#L113 | C198: TODO | D198: wB97X-D3
A199: wB97X-D | B199: https://github.com/psi4/psi4/blob/bf9d20fc579995b0bc2c38b749a31c0d6f85c82e/psi4/driver/procrouting/dft/libxc_functionals.py#L112 | C199: TODO | D199: wB97X-D
A200: wB97X | B200: https://github.com/psi4/psi4/blob/bf9d20fc579995b0bc2c38b749a31c0d6f85c82e/psi4/driver/procrouting/dft/libxc_functionals.py#L111 | C200: TODO | D200: wB97X
A201: wB97X-rV | B201: x | C201: TODO | D201: ?
A202: wB97X-V | B202: https://github.com/psi4/psi4/blob/bf9d20fc579995b0bc2c38b749a31c0d6f85c82e/psi4/driver/procrouting/dft/libxc_functionals.py#L115 | C202: TODO | D202: wB97X-V
A203: wM05-D | B203: x | C203: TODO | D203: ?
A204: wM06-D3 | B204: x | C204: TODO | D204: ?